{
  "$schema": "../../../../schemas/content-home.schema.json",
  "intro": "עונים על היגדים מתוך המחלוקות של הבחירות האלה, ומקבלים השוואה מול {{lists}} רשימות. לכל רשימה נבדק גם מה היא אמרה וגם מה עשתה בפועל, וכל ערך מקושר לראיה שעליה הוא נשען. כשלא נמצאה עמדה, הכלי אומר את זה ולא מנחש.",
  "shortDuration": "3 דקות",
  "longDuration": "15 דקות",
  "beforeStart": "התוצאה היא נקודת פתיחה לבדיקה ולא המלצה. ההיגדים לקוחים מהמאגר \"מה אמרו, ומה עשו\", והם לא מכסים כלכלה, יוקר מחיה ודיור, כי לא מצאתי מקור שמשווה בהם את כל הרשימות בצורה שיטתית. במסלול המלא הנושאים האלה מופיעים לבדיקה עצמית. כדאי להשוות את התוצאה לעוד כלי אחד לפחות."
}
